{"schema_version":1,"subject":{"engineer":"Maya R","repo":"fixture","tenure":{"from":"2024-01-02","to":"2024-05-01"},"sources":["git","jira"]},"stats":{"commits":108,"prsMerged":14},"skills":[{"name":"API design","subtitle":"rest · pagination","prs":9,"commits":40,"lastTouched":"2024-05-01","activity":{"unit":"quarter","values":[4,12,24]}}],"phases":[{"key":"act-1","title":"Learning the terrain","from":"2024-01-02","to":"2024-03-01","narrative":"Ramp-up and first features."}],"signals":[{"source":"Jira","name":"Tickets delivered","to":9,"rows":[{"label":"Epics","value":1}]}],"accomplishments":[{"id":"a1","category":"API design","title":"Shipped paginated listing API","phase":"act-1","date":"2024-02-10","star":{"situation":"Endpoints returned unbounded lists <at scale>.","task":"Bound the payloads.","action":"Added cursor pagination.","result":"p95 payload cut 30x."},"resumeBullet":"Cut list-endpoint p95 payload 30x via cursor pagination.","confidence":85,"evidence":[{"type":"pr","ref":"14"},{"type":"commit","ref":"abc123def4"},{"type":"ticket","ref":"PROJ-13"}]},{"id":"a2","category":"Docs","title":"Fixed a typo","confidence":5,"evidence":[{"type":"commit","ref":"beef00"}]}],"ledger":[{"group":"API design","items":["cursor pagination","rate limiting"]}]}